{
  "$schema": "https://json-schema.org/draft/2020-12/schema",
  "$id": "https://runecode.dev/protocol/schemas/objects/ApprovalRequest.schema.json",
  "title": "ApprovalRequest",
  "description": "Protocol-owned approval request family. Requests are hash-bound to immutable inputs, carry shared principal identity context, and keep approval triggers in their own registry with fail-closed runtime validation.",
  "type": "object",
  "additionalProperties": false,
  "maxProperties": 14,
  "required": [
    "schema_id",
    "schema_version",
    "approval_profile",
    "requester",
    "approval_trigger_code",
    "manifest_hash",
    "action_request_hash",
    "relevant_artifact_hashes",
    "details_schema_id",
    "details",
    "requested_at",
    "expires_at",
    "staleness_posture",
    "changes_if_approved"
  ],
  "properties": {
    "schema_id": {
      "const": "runecode.protocol.v0.ApprovalRequest",
      "description": "Stable protocol object-family identifier for approval requests.",
      "x-data-class": "public"
    },
    "schema_version": {
      "const": "0.2.0",
      "description": "Exact protocol schema version used to validate this approval request.",
      "x-data-class": "public"
    },
    "approval_profile": {
      "type": "string",
      "enum": [
        "moderate"
      ],
      "description": "Approval profile in effect for this request. MVP supports only the moderate profile.",
      "x-data-class": "public"
    },
    "requester": {
      "$ref": "PrincipalIdentity.schema.json",
      "description": "Shared principal identity for the actor requesting human approval.",
      "x-data-class": "sensitive"
    },
    "approval_trigger_code": {
      "type": "string",
      "minLength": 1,
      "maxLength": 128,
      "description": "Machine-consumed trigger code explaining why human approval is being requested. Registry membership is validated fail-closed by runtime policy and manifest tooling rather than by a schema enum.",
      "x-data-class": "public"
    },
    "manifest_hash": {
      "$ref": "Digest.schema.json#/$defs/digestValue",
      "description": "Hash of the active signed manifest context bound to this approval request.",
      "x-data-class": "public"
    },
    "action_request_hash": {
      "$ref": "Digest.schema.json#/$defs/digestValue",
      "description": "Hash of the action request or stage summary whose approval outcome is being requested.",
      "x-data-class": "public"
    },
    "relevant_artifact_hashes": {
      "type": "array",
      "maxItems": 64,
      "description": "Hashes of artifacts whose exact bytes are part of the approval decision context. An empty array is valid when only the manifest and action request hashes are relevant.",
      "x-data-class": "public",
      "items": {
        "$ref": "Digest.schema.json#/$defs/digestValue",
        "description": "Hash of one artifact that is part of the approval context."
      },
      "uniqueItems": true
    },
    "details_schema_id": {
      "type": "string",
      "minLength": 1,
      "maxLength": 256,
      "description": "Schema identifier for the structured details payload shown to the human reviewer.",
      "x-data-class": "public"
    },
    "details": {
      "type": "object",
      "minProperties": 1,
      "maxProperties": 32,
      "description": "Structured details payload whose shape is defined by details_schema_id; freeform-only prompts are not sufficient.",
      "x-data-class": "sensitive"
    },
    "requested_at": {
      "type": "string",
      "format": "date-time",
      "maxLength": 64,
      "description": "RFC 3339 timestamp recording when the approval request was issued.",
      "x-data-class": "public"
    },
    "expires_at": {
      "type": "string",
      "format": "date-time",
      "maxLength": 64,
      "description": "RFC 3339 timestamp recording when the approval request expires; there is no implicit protocol default. Runtime validation must reject timestamps that do not fall after requested_at.",
      "x-data-class": "public"
    },
    "staleness_posture": {
      "type": "string",
      "const": "invalidate_on_bound_input_change",
      "description": "Fail-closed staleness rule for the request. If any bound hash changes before approval is consumed, the request is invalid.",
      "x-data-class": "public"
    },
    "changes_if_approved": {
      "type": "string",
      "minLength": 1,
      "maxLength": 1024,
      "description": "Clear human-facing summary of what will change if this request is approved.",
      "x-data-class": "sensitive"
    }
  }
}
