{"action_request_hash":{"hash":"2222222222222222222222222222222222222222222222222222222222222222","hash_alg":"sha256"},"approval_profile":"moderate","approval_trigger_code":"gateway_egress_scope_change","changes_if_approved":"Allow the gateway to use the requested provider allowlist for this run.","details":{"requested_scope":"model_provider_allowlist"},"details_schema_id":"runecode.protocol.details.approval.gateway-egress.v0","expires_at":"2026-03-13T12:30:00Z","manifest_hash":{"hash":"1111111111111111111111111111111111111111111111111111111111111111","hash_alg":"sha256"},"relevant_artifact_hashes":[],"requested_at":"2026-03-13T12:00:00Z","requester":{"actor_kind":"local_client","instance_id":"client-1","principal_id":"cli-user","schema_id":"runecode.protocol.v0.PrincipalIdentity","schema_version":"0.2.0","session_id":"session-1"},"schema_id":"runecode.protocol.v0.ApprovalRequest","schema_version":"0.2.0","staleness_posture":"invalidate_on_bound_input_change"}
